### ISSUE TITLE
tcpdump 抓包

### ISSUE THREAD

**Issue by JasonJe** [JasonJe/notes#28]
`tcpdump` 默认只截取前 `96` 字节的内容。

要想截取所有的报文内容，可以使用`-s number`，`number`就是要截取的报文字节数.

如果是`0`的话，表示截取报文全部内容。

1. 常用参数

* `-n` 表示不要解析域名，直接显示 `ip`；

* `-nn` 不要解析域名和端口；

* `-X` 同时用 `hex` 和 `ascii` 显示报文的内容；

* `-XX` 同 -X，但同时显示以太网头部；

* `-S` 显示绝对的序列号(`sequence number`)，而不是相对编号；

* `-i any` 监听所有的网卡；

* `-v, -vv, -vvv` 显示更多的详细信息；

* `-c number` 截取 `number` 个报文，然后结束；

* `-A` 只使用 `ascii` 打印报文的全部数据，不要和 `-X` 一起使用。截取 `http` 请求的时候可以用 `sudo tcpdump -nSA port 80`

2. 过滤器

* `host`: 过滤某个主机的数据报文

```bash
tcpdump host 1.2.3.4
```

* `src, dst`: 过滤源地址和目的地址

```bash
tcpdump src 2.3.4.5
tcpdump dst 3.4.5.6
```

* `net`: 过滤某个网段的数据，`CIDR` 模式

```bash
tcpdump net 1.2.3.0/24
```

* `proto`: 过滤某个协议的数据，支持 `tcp`， `udp` 和 `icmp`。使用的时候可以省略 `proto` 关键字。

```bash
tcpdump icmp
```

* `port`: 过滤通过某个端口的数据报

```bash
tcpdump port 3389
```

* `src/dst, port, protocol`: 结合三者

```bash
tcpdump src port 1025 and tcp
tcpdump udp and src port 53
```

* 指定 `port` 范围
```
tcpdump portrange 21-23
```

* 指定数据报文范围（单位：字节）

```bash
tcpdump less 32
tcpdump greater 128
tcpdump > 32
tcpdump <= 128
```

3. 逻辑组合

常用：`AND, &&, OR, ||, not, !`

* 源地址是 `10.5.2.3`，目的端口是 `3389` 的数据报

```bash
tcpdump -nnvS src 10.5.2.3 and dst port 3389
```

* 从 `192.168` 网段到 `10` 或者 `172.16` 网段的数据报

```bash
tcpdump -nvX src net 192.168.0.0/16 and dat net 10.0.0.0/8 or 172.16.0.0/16
```

* 从 `Mars` 或者 `Pluto` 发出的数据报，并且目的端口不是 `22`

```bash
tcpdump -vv src mars or pluto and not dat port 22
```

4. 输出

* 输出到文件

```
tcpdump -w capture_file.pcap port 80
```

* 读取文件并显示

```
tcpdump -nXr capture_file.pcap host web30
```

* 输出理解

```
21:27:06.995846 IP (tos 0x0, ttl 64, id 45646, offset 0, flags [DF], proto TCP (6), length 64)
    192.168.1.106.56166 > 124.192.132.54.80: Flags [S], cksum 0xa730 (correct), seq 992042666, win 65535, options [mss 1460,nop,wscale 4,nop,nop,TS val 663433143 ecr 0,sackOK,eol], length 0

21:27:07.030487 IP (tos 0x0, ttl 51, id 0, offset 0, flags [DF], proto TCP (6), length 44)
    124.192.132.54.80 > 192.168.1.106.56166: Flags [S.], cksum 0xedc0 (correct), seq 2147006684, ack 992042667, win 14600, options [mss 1440], length 0

21:27:07.030527 IP (tos 0x0, ttl 64, id 59119, offset 0, flags [DF], proto TCP (6), length 40)
    192.168.1.106.56166 > 124.192.132.54.80: Flags [.], cksum 0x3e72 (correct), ack 2147006685, win 65535, length 0
```

1. `192.168.1.106.56166 > 124.192.132.54.80`：源地址 `ip` 是 `192.168.1.106`，源端口是 `56166`，目的地址是 `124.192.132.54`，目的端口是 `80`。 `>` 符号代表数据的方向。

2. 常见的 `TCP` 报文的 `Flags`：

- * `[S]`： `SYN`（开始连接）

- * `[.]`: 没有 `Flag`

- * `[P]`: `PSH`（推送数据）

- * `[F]`: `FIN` （结束连接）

- * `[R]`: `RST`（重置连接）

- * `[S.]`: `SYN-ACK`（`SYN` 报文的应答报文）
